{
  "descricao": "Valor de pH de referencia de algumas culturas",
  "fonte": {
    "manual": "CQFS-RS/SC, 11. ed., 2016",
    "tabela": "5.1",
    "pagina": 68,
    "extraido_do_pdf_em": "2026-08-16",
    "conferido_por_autor_em": "2026-08-16"
  },
  "nota_importante": "O pH de referencia NAO e suficiente para decidir a calagem. A condicao de disparo e o pH alvo da dose vem das Tabelas 5.3 a 5.7, por grupo de cultura. Ex.: graos tem pH ref 6,0, mas so recebem calcario quando pH < 5,5.",
  "grupos": [
    {
      "ph_referencia": 6.5,
      "culturas": [
        "alfafa",
        "aspargo",
        "macieira",
        "oliveira",
        "piretro"
      ]
    },
    {
      "ph_referencia": 6.0,
      "culturas": [
        "abacateiro",
        "abóbora",
        "abobrinha",
        "alcachofra",
        "alface",
        "alho",
        "almeirão",
        "ameixeira",
        "amendoim",
        "arroz-de-sequeiro",
        "aveia",
        "bananeira",
        "batata-doce",
        "berinjela",
        "beterraba",
        "brócolis",
        "cana-de-açúcar",
        "camomila",
        "canola",
        "capim-limão",
        "caquizeiro",
        "cebola",
        "cenoura",
        "centeio",
        "cevada",
        "chicória",
        "chuchu",
        "citros",
        "consorciação-de-gramíneas-e-leguminosas-de-estação-fria",
        "consorciação-de-gramíneas-e-leguminosas-de-estação-quente",
        "couve-flor",
        "crisântemo",
        "ervilha",
        "ervilha-forrageira",
        "ervilhaca",
        "estévia",
        "feijão",
        "figueira",
        "gengibre",
        "girassol",
        "gramíneas-forrageiras-de-estação-fria",
        "gramíneas-forrageiras-de-estação-quente",
        "hortelã",
        "leguminosas-forrageiras-de-estação-fria",
        "leguminosas-forrageiras-de-estação-quente",
        "linho",
        "mandioquinha-salsa",
        "maracujazeiro",
        "melancia",
        "melão",
        "milho",
        "milho-pipoca",
        "moranga",
        "morangueiro",
        "nabo",
        "nabo-forrageiro",
        "nectarineira",
        "nogueira-pecã",
        "painço",
        "palma-rosa",
        "pepino",
        "pereira",
        "pessegueiro",
        "pimentão",
        "quivizeiro",
        "rabanete",
        "repolho",
        "roseira-de-corte",
        "rúcula",
        "soja",
        "sorgo",
        "tabaco",
        "tomate",
        "tremoço",
        "trigo",
        "triticale",
        "urucum",
        "vetiver",
        "videira"
      ]
    },
    {
      "ph_referencia": 5.5,
      "culturas": [
        "alfavaca",
        "amoreira-preta",
        "arroz-irrigado-semeadura-em-solo-seco",
        "batata",
        "calêndula",
        "camomila",
        "cardamomo",
        "carqueja",
        "chá",
        "citronela-de-java",
        "coentro",
        "cúrcuma",
        "erva-doce",
        "funcho",
        "guaco",
        "manjericão",
        "mirtilo",
        "palmeira-juçara",
        "palmeira-real",
        "pupunheira",
        "salsa"
      ]
    },
    {
      "ph_referencia": null,
      "observacao": "Tolerantes a acidez; calagem apenas para suprimento de Ca e Mg (ver criterio de V% nas Tabelas 5.5 e 5.6)",
      "culturas": [
        "arroz-irrigado-pre-germinado-ou-transplante",
        "araucária",
        "acácia-negra",
        "bracatinga",
        "cedro-australiano",
        "erva-mate",
        "eucalipto",
        "pinus",
        "mandioca",
        "pastagem-natural"
      ]
    }
  ],
  "rotacao_de_culturas": "Em rotacao, usar o pH de referencia da cultura mais sensivel (a que exigir pH mais elevado). Excecao: batata em rotacao com culturas de pH ref 6,0 -> manter limitado a 5,5 (qualidade do tuberculo)."
}